,Name,Overall_Rating,Food_Rating,Service_Rating,Ambience_Rating,Dined_Date,Reviews
468,suziedewitt,5,5,5,5,45031,Paulo was our waiter and he was AWESOME!! We (3ladies) were a little loud celebrating the fact that my husband called ahead and paid for dinner. Paola and the other WADE stuff were really great. We had a wonderful evening. The wine was excellent. Food was excellent.!
469,Boppy,5,5,5,5,45031,Our experience was phenomenal!  Our table was beautiful and the presentation was impressive.  Had a wonderful night!
470,DianaR,5,5,5,5,45031,Celebrating a birthday! Paulo was amazing and made our experience incredible
471,TedA,5,5,5,4,45031,"Amazing food, great service. A little loud but that just meant folks were enjoying the evening. We had a great night."
472,OpenTable Diner,5,5,5,4,45030,Always excellent in every way. The noise level in the restaurant is sometimes difficult . We prefer the bar.
473,steven,5,5,5,5,45028,"Have enjoyed the Seattle location for many years but for this
visit we tried Bellevue. The server was terrific. All good."
474,OpenTable Diner,5,5,5,5,45027,Lovely service! Attended for my brothers birthday. They seated us 30 mins earlier than our reservation which was really nice. Service was attentive and timely. Great place for a quiet dinner with great food.
475,AliceC,5,5,5,5,45027,This was our second time for dinner and both were excellent meals and service and beautiful atmosphere.  This is now our go to restaurant for all occasions. Thank you Carmine’s!
476,justin,5,5,5,5,45027,Excellent birthday dinner for my wife.  Food was excellent.
477,MIHS,5,5,5,5,45026,Love this restaurant. Always a great experience and meal for either lunch with friends or a dinner date.
478,iiiiiiiiii,5,5,5,5,45024,Pppppppppppppppppppppppppppppppppppppppppppppppppppp
479,OpenTable Diner,5,5,5,5,45024,Always good. Have dined at both locations and never had a bad meal
480,OpenTable Diner,4,4,3,4,45024,"We felt rushed by the staff person who took our orders.
Some customers were very loud, laughing like no one else was present."
481,Winne2,5,5,5,4,45023,"I am not a local, but Carmine's has become my go-to dinner spot to meet with customers, business partners, and friends on the Eastside.  The calamari fritti were excellent, including the dipping sauces, and the fresh garden salads with a balsamic vinaigrette were a great palate cleanser before the main course.  

This week's halibut special, dredged in crushed pistachios, was exceptional - the preparation was outstanding and the combination of flavors excellent.  Thursday seemed to be date night - as well as martini night - so the scene for a couple of business people was entertaining!"
482,AnjuliM,5,5,5,5,45023,"My husband and I came in for dinner last night and had such a great time! We had the burrata appetizer with arugula with fig balsamic and cherry tomatoes to start, it was so fresh and delicious. We split the Filetto con gnocchi and the risotto with crab, mushrooms and truffle oil (so decadent), but the real star of the meal for us was the steak—it melted in our mouths. Loved the gnocchi and veggies it came with too. Our server, Cat, recommended amazing wine to compliment the food, was so thoughtful about our time constraints with the coursing and knowledgeable about the menu. We felt so pampered on a rare night out without kids, we can’t wait to come back!"
483,SanFran,5,5,5,5,45023,Lovely spot for date night. Fresh Italian food & fantastic service.
484,OpenTable Diner,5,5,5,5,45022,"My girlfriend and I came in for my birthday last night. We were blown away by the charming impeccable service and the delicious food. The ambience was amazing, great energy all around. Everyone around us also seemed to be enjoying themselves. We toasted with an amazing gin based cocktail called A Night in Milano. We had the fillet with gnocchi, pistachio crusted halibut, and the spaghetti with fennel sausage. The finale was red velvet cake (we really appreciated the complementary tiramisu dessert with happy birthday written in chocolate too)! I felt special and spoiled, it was a beautiful birthday to remember. Thank you to everyone at Carmine’s!"
485,JoeS,5,5,5,5,45022,The staff is awesome and the food is remarkable.  The risotto and salmon was to die for.
486,Jill,5,5,5,5,45021,Food is consistently delicious at Carmine's! I had the special- mac & cheese with dungeness crab. This entree must be put on the regular menu...it's so good! The bread here is also so yummy and fresh every time. We love Carmine's.
487,JamesW,4,5,3,4,45021,"Overall dinner experience was quite good.
Hard to carry on a conversation with the noise level in the dining room.
Completely parking a REAL PLUS."
488,BobW,5,5,5,5,45021,"Always love going to Carmine's...whether it be Bellevue or Seattle.  Food, service and ambience are always topnotch.  Keep up the great work!"
489,AnnS,5,5,5,5,45021,"Wonderful as always. I love Carmine’s Bellevue! The outdoor dining area is beautiful, with heat for cold days. The food is excellent. I highly recommend it!"
490,OpenTable Diner,5,4,5,4,45017,"We come here all the time. Carmines is our favorite restaurant in Bellevue!

My experience is as a little off this time around but the owner Philip called me and immediately made things right. Speaks volume of their character and why the restaurant restaurant is ran so well.

I highly recommend dining here. You will not regret it."
491,Keddy,4,4,5,4,45017,"Overall experience was great. Best thing was the food. I’ve been
to a lot of restaurants and i must say this the best steak I’ve had! I had it well done and it was not dry. Full of flavor and just melt in your mouth. My girlfriend and i went for just a Friday night date night and we spent little over $200 for the two of us including tip. Great experience amazing staff will come back for sure!"
492,GerryZ,5,5,5,5,45017,Much enjoyed the restaurant. Service was excellent
493,GregB,5,5,5,5,45014,"Great food, terrific wine list and Paolo was an excellent, informed and attentive host."
494,BillF,4,4,5,3,45014,"Everything was great, except for noise level. 
We had to raise our voices to be heard across a small table."
495,Travelerswife,5,5,5,5,45014,Carmines never disappoints with their overall excellence.
496,JeffK,5,5,5,5,45011,Amazing - best Italian in the whole area.  Service and environment is perfect for special occasions
497,JasonE,5,5,4,3,45010,"Great food, although the acoustics in the restaurant made it too noisy to have a conversation even at our own table of four people"
498,SandyR,5,5,5,5,45009,Great place for special lunch.  Arrive early for best seating.  Parking takes time to find.
499,Tony,3,3,3,3,45009,"We had very good memories of the original Carmines in Pioneer Square so we tried dinner at their Bellevue location. 
We asked for two glasses of wine and were amazed that we were charged $30 per glass. No comment from the waiter as to pricing. The rest of the meal was of reasonable quality but again overpriced. $200 for two people. 
Many other good restaurants in Bellevue for use to attend."
500,JayLeeC,5,5,5,5,45009,"Dinner was delicious, as always. The staff goes above and beyond to make your dining experience wanting you to come back again and again."
501,OpenTable Diner,5,5,5,5,45006,My son took me here for a birthday lunch. Everything was wonderful. 10/10 would recommend 😀
502,KatieM,5,5,5,5,45004,It was our first visit to Carmines. Walking in the patio was absolutely stunning and the inside as well with all of the details. The service was wonderful and very helpful. We ordered two of the specials and those were good but next time I am definitely ordering a big bowl of pasta! The taste I got from the pasta was to die for!
503,OpenTable Diner,5,5,5,5,45003,Incredible experience at Carmine’s. We had Matthew as our server and he was a complete delight. Very attentive and charming. Food was better than what I’ve had in Italy. We will be back!
504,OpenTable Diner,5,5,5,5,45003,Loved everything about the place from food to service to ambiance!!  Thank you!
505,OpenTable Diner,5,5,5,5,45003,Same high level of competence as usual.  Everything is good !
506,MelKirkland,5,5,5,5,45002,Hands down my favorite restaurant in Bellevue! Their food is always amazing and the service is top notch!
507,TonyM,4,5,5,5,45002,Everything was great but a $35 fee for corkage is too much!
508,Diner,5,5,5,5,45001,"Excellent experience, highly recommend.  Service and good is exceptional."
509,JohnU,5,5,5,5,45001,Great food and a wonderful server.  Definitely coming back!
510,BrianC,5,5,5,5,44998,Carmines is excellent
511,BrianL,5,5,4,4,44997,"Great food and vibes!
Oso buco was delicious . Seafood was super fresh."
512,OpenTable Diner,5,5,5,5,44996,"we had the most fabulous attentive waiter, the food was excellent!! the waiters recommendations were spot on!!"
513,TanyaR,5,5,5,5,44996,Such an amazing place with incredible food and service
514,TeeVibe,5,5,5,5,44996,"This was my first visit to Carmine's, but it won't be my last.  We were immediately seated, had amazing service and the restaurant itself is beautiful.  I was even more impressed by the flavor of the food and that my food was actually hot when it came to the table.  You would be surprised how often that doesn't happen.  It was expensive, but worth a very special occasion or celebration."
515,OpenTable Diner,5,5,5,5,44996,"Always professional service, excellent food  and wine. Everything goes well."
516,JanetG,5,5,5,5,44996,1st time I’ve tried Carmine’s and have already recommended it to others :-)
517,SkipB,5,5,5,4,44995,"Wonderful menu and wine list.  Lovely restaurant.  Excellent service.  Food is beautifully presented and absolutely delicious (NY steak and Lobster risotto entrees, tiramisu and mousse desserts).  The noise level was very high because of large, loud groups on a Thursday night so I can't recommend it for a romantic dinner (conversation is difficult) but we really enjoyed dining here and will return!"
518,Jenn,5,5,5,4,44995,Variety of delicious dishes.  Service was impeccable.
519,Tuckerboy,5,5,5,5,44995,"Great place for a weekday lunch. Comfortable,
Great service, fresh delicious food. One of the few ‘old school’ style dining experience left .Superb!!!"
520,TraceyH,4,5,5,3,44994,The food and service provided by Michael were excellent.  It was so loud in the restaurant I could barely hear the people at my table which detracted from enjoying the evening.
521,TeresaH,5,5,4,5,44994,"Great food, adequate service
Needed waters refilled, etc."
522,JohnT,5,5,5,5,44994,Always amazing and they always deliver! Miriam was our server and she's the best. One of my favorite restaurants.
523,JoshMitchell,5,5,5,5,44993,Wow! What a dinner. We were celebrating my dad's birthday and they went above and beyond for us! They had a very kind birthday note written for him at the table when we sat down. The wait staff were all very friendly and the dinner was amazing! Every item we had blew away our expectations. The Gorgonzola crusted NY strip was the favorite. We will be back again!
524,Karen,5,5,5,5,44993,"Always an elegant experience, lovely setting, charming waitstaff."
525,Matty,5,5,5,5,44992,"Great as always.  Delicious food, good wine selection, wonderful service, and tasty desserts."
526,MaryG,4,4,5,4,44988,"Service was fantastic from all waitstaff.  Food was very good except for halibut which was overcooked.  They took it off bill, which was nice but disappointing a bit in terms of experience."
527,OpenTable Diner,5,5,5,5,44987,"The food, the service, the ambiance - always amazing. Highly recommend. Dinner at their Bellevue or Seattle location, never disappoints!"
528,CindyR,5,5,5,5,44987,"Consistently fabulous. The food, quality specials, the service, EVERYTHING about Carmines is delicious. Our group of four especially enjoy the bar seating as it is so much quieter for conversation. Thank you! Grazie!"
529,OpenTable Diner,5,5,5,4,44986,"We had a great time.

However I find all the dining chairs to be very uncomfortable.  The padding is worn out in the seat which makes the seating too low. Time to replace them."
530,ShaunaB,5,5,5,5,44986,"Carmines was perfect. The menu was outstanding and the food tasted so good. We had wine, appetizers, main dish and dessert.  Everything we had exceeded my expectations!"
531,GailL,5,4,5,4,44983,Lovely dinner! Love Carmine’s decor. Food was delicious. Service was excellent. Wish it was easier to get reservations and to get into the parking garage!
532,OpenTable Diner,5,5,5,5,44982,Great food and service. Jarrod was an exceptionally good server!
533,OpenTable Diner,5,5,5,5,44981,Had a fun time celebrating my daughters birthday!
534,DawnG,5,5,5,5,44981,Such a great experience - food and service were both expectational.
535,Zach,5,5,5,5,44979,"Great spot to take a date and have a night out. The environment was great, location was awesome right downtown, and parking is easy!"
536,OpenTable Diner,5,5,5,5,44978,"We never fail to love Carmine’s.  We requested and received our preferred booth seating inside, and the service was, as always, spot on.  We never feel rushed and are always accommodated and feel welcome.  The bar drink (Gunsmoke Manhattan) was great, the wines by the glass to follow excellent with our meals.  The sautéed spinach is a tour de force every time, the warm bread and butter a guilty pleasure.  We split “cups” of the minestrone soup which is portioned like a bowl and tastes like it was delivered from a fresh vegetable garden.  The venison ravioli with spinach and mushrooms was outstanding.  The flavors of everything down to the lemon meringue dessert are fresh, and intense.  Lovely late lunch again.  Compliments to the house, the staff, the chef.  Thank you."
537,OpenTable Diner,5,4,5,5,44974,Our server Daniel was amazing. Made our first visit to Carmine’s such a wonderful experience. Will return again.
538,Jesk,5,5,5,5,44973,Fabulous food! Quality service/staff! Great location
539,KatieW,5,5,5,5,44972,The best meal we’ve ever had and amazing staff!!!!
540,Tifa,5,5,4,5,44972,Carmines a favorite now for our family and we love the food and the ambiance! It’s our goto for all occasions.
541,OpenTable Diner,5,5,5,5,44968,My friends and I came into Carmines for to celebrate a birthday. We had a great time and thank the staff for an amazing meal and attentive service. We will be back!
542,DianaB,4,5,5,2,44968,"We love the excellent food, attentive service, and elegant presentation, but find the noise to be too much…as well as the difficulty in finding parking.  We’ve had several celebratory dinners and lunches at Carmine’s, but may not return simply because we can’t converse over the clamor.  Maybe some sound management such as carpeting or a matt flooring would help.  Otherwsie very good!  Thank you.

Would recommend to a friend, but with a caveat about the noise."
543,OpenTable Diner,5,5,5,5,44967,My boyfriend and I had a perfect meal at Carmines. The food was so delicious and the service was fun yet professional. We loved the rigatoni bolognese and the veal with capers. We can’t wait to visit Carmine’s again soon!
544,OpenTable Diner,5,5,5,5,44967,"My wife and  I had an amazing evening at Carmines. The food came out hot and  perfectly prepared. We started with prawns in tomato sauce, then moved on to the grilled romaine salad. For the main course the rack of lamb and the nightly steak special served  oscar style…all incredible. The steak was the best steak I have had in a long time. We finished our evening with espresso martinis and the dessert special of the night, strawberry cheesecake. The service was perfectly paced and we left feeling spoiled and beyond satisfied. Thank you Carmines for a wonderful evening. We will be back!!"
545,SPWS,5,5,5,5,44967,"Great Italian food, chic ambiance and excellent service. Highly recommend this restaurant to everyone."
546,anne,5,5,5,4,44967,"Celebrating an early Valentine’s Day.  Great wines by the glass, pasta with sausage and fennel was delicious as was the potato encrusted halibut.  Wonderful menu!"
547,BrandynH,4,5,4,4,44966,"The food is TOP NOTCH here as always
It's a great place for a celebration or just a random Wednesday night out."
548,JimR,5,5,5,5,44965,"Truly a wonderful place to have lunch or a dinner. Excellent food, excellent service"
549,RobertoG,5,5,5,5,44965,"My sister and I have a wonderful time at Carmine’s Bellevue!

We really enjoy the burrata!
The homemade pastas are so delicious!  Fettuccine Al Pesto, Rigatoni Bolognese 😘

The cedar plank salmon must have!"
550,ArnieB,3,4,2,3,44964,Food was good. Service not so good last night. Despite a reservation made 2 weeks in advance we were seated at a poor table. Very cramped for two and in a major walkway. Service was slow and inattentive.
551,Nikolay2,5,5,5,5,44964,Everything is good although parking is chore with Q codes dealings
552,Minnie,3,3,3,4,44962,"Table wasn’t ready when we were sat. Hostess had to finish setting table, while we were sitting. Waited a long time for server to come to our table. Steak was overdone. Asked for medium. Received medium well. Have had much better dinners and service at this price point."
553,DennisC,5,5,5,5,44962,"Pretty loud, but always great!"
554,OpenTable Diner,5,5,5,5,44958,Amazing experience!
555,JohnP,5,5,5,5,44958,"Excellent dining, food and atmosphere, as usual !"
556,eatsoutoften,5,5,5,5,44958,Always have a great meal at Carmine's.  Daniel was our server and his service as usual was impeccable.    Love this restaruant!
557,OpenTable Diner,5,5,5,5,44957,Always the best at Carmine’s!
558,Steve,5,5,5,5,44957,"I go to this restaurant often! The service, ambiance, food and wine is always exceptional."
559,Tbik,5,5,5,5,44957,Great birthday lunch for a dear and deserving friend!
560,OpenTable Diner,5,5,5,5,44955,"If you are looking for an all around elevated experience Carmine’s is the place. The cocktail and wine menu is exciting. Go for Beef Tartare, the spaghetti with homemade pasta and fennel sausage and the Ossobucco. Great nightly specials too! Every dessert (spumoni and red velvet cake) is amazing too! The welcoming staff makes you feel at home while the fancy vibe reminds you that you are somewhere special. Thank you Carmines for your consistency and supreme unmatched hospitality. 👏🏻👏🏻"
561,OpenTable Diner,5,5,5,5,44955,"The best restaurant in the city by far- potentially the state. Ossobucco is always divine and the chefs specials are always thoughtful and wonderful!

Service could not be better, unobtrusive but attentive.

WOW!"
562,oliver,5,5,5,5,44955,Where do I begin? Service: outstanding. Food: impeccable. Ambience: immaculate. Deserves Michelin recognition.
563,CarlW,5,5,5,5,44954,"Carmines was an excellent place to celebrate my wife’s birthday. Prompt service, delicious drinks, excellent service and the ambiance that made her birthday everything she wanted. We will be back for more celebrations in the future."
564,kaym,5,5,5,5,44953,First time at the Bellevue location for a friends birthday. Fabulous! Did not disappoint! Parking was tough…
565,luckylindy98072,5,5,5,5,44951,Everything was amazing except for our little table next to the stairs. I expected much more in that I made the reservation days in advance on Open Table and they stated that I’m a VIP…which apparently doesn’t mean much :)
566,ShellyL,5,5,5,5,44951,"Outstanding food, and service in the bar by Alberto and the team were amazing, as usual."
567,Christoph,5,4,5,5,44951,"Excellent service, and excellent menu.  Will return."
568,ac209,5,5,5,5,44950,The best Italian and maybe the best restaurant in Bellevue.  Unpretentious.  These people love what they do.
569,go4sid,3,3,2,3,44947,Food and wine were great. Good ambience although it was a bit too crowded for me.
570,MarieV,5,5,5,5,44947,We love the atmosphere and the service.  We’re never disappointed in the food!  It’s always outstanding!!
571,JohnM,5,5,5,5,44947,Excellent food and service was over the top. Little on the pricey side but you get what you pay for applies.  Great place to eat.
572,msbobh,5,4,5,4,44945,"Service and staff were excellent, as was the special lobster risotto. A salmon pasta dish was underwhelming due to the salmon.  Otherwise the preparation was fine, lots of garlic and olive oil."
573,LQKNEE,5,5,5,5,44945,Always wonderful!!
574,GreatDinner,5,5,5,5,44940,Alberto provides awesome service! Food is superb.
575,RenatoF,5,5,3,5,44940,Delicious food!
576,OpenTable Diner,5,5,5,5,44940,Perfect as always!!
577,Lauriek,5,5,5,4,44939,"Had our favorite amazing server Kat, got our preferred table in the Back 40 and the food was wonderful, as always.  Took our relatives visiting from the U.K. for their last night and it was a great evening."
578,MaggieD,5,5,5,5,44939,The food and service was amazing. Love this place!
579,JULIEL,5,5,5,5,44939,"Wonderful food, great ambiance, feels like you are in Italy."
580,OpenTable Diner,5,5,5,5,44939,"Everything about Carmine’s is always so elegant, professional, friendly.  The food was delicious (squid ink cappellini) and the service was attentive.  I love the white tablecloths, the servers in their white jackets.  The atmosphere is like being in a starred restaurant in Italy.  Very special.  Carmine’s and Il Terrazzo have been my go-to dining for special events for YEARS."
581,YolandaS,4,3,4,3,44937,The foods were unusually salty that day we sent back 1 dish but ate the rest didn’t want to cause problem
582,JillR,5,5,5,5,44936,Great service. Great selection of food. Wonderful experience for lunch on a Monday in Bellevue.
583,Gippy,5,5,4,5,44934,Food was amazing.  We sat for about 15 minutes prior to seeing a server.  Very apologetic about the oversight.
584,RobynL,5,5,5,5,44934,Our waiter was outstanding and so attentive!  Amazing food as always!
585,OpenTable Diner,4,4,3,5,44933,"Overall good, service is a bit slow."
586,Jared,5,5,5,5,44932,"Great experience on all levels, a wonderful place for dining with friends."
587,RobbieA,5,5,5,5,44932,"Daniel was a fabulous server. So kind and attentive. Our steak salads were divine!
Thank you."
588,SUSIE,5,5,5,5,44932,Excellent and fun
589,Woodinvilledad,5,5,5,4,44930,Great food and great service. Tends to be noisy. But food is so worth it
590,GregC,5,5,5,5,44930,We love dining in the bar. Alberto and team are always fantastic.
591,Daisy,5,5,5,5,44929,Very good service.  onetime reservation seating.  Food served hot and in a timely manner.
592,Rosie,5,5,5,5,44929,"The Rack of Lamb was beyond description. Outstanding is an understatement. Same for the Roasted Duck. Our server, Jocelyn D,  is the true definition of a professional - so gracious, cheerful, responsive and an ingredient that added so much to a perfect evening."
593,Belltowndiners,5,5,5,5,44927,Our first opportunity to dine at this location.  Now a new favorite!  The staff from hosts to servers and kitchen was as good as it gets.  Our server Paolo was exceptional.  He knew the menu inside out and had great recommendations.  And the menu selection has every possible Italian favorite including often hard-to-find Oso Bucco.  We can’t wait to return.
594,Four,5,5,5,5,44926,Always delicious food and excellent service!  Our favourite Italian restaurant
595,CareFriends,5,5,5,5,44926,"Always a lovely experience at Carmines. Good food, good services, lovely environment. Valet parking also a plus."
596,LynneL,5,5,5,5,44925,"Took out-of-town family in for Christmas for a lovely dinner after a show at the Paramount.  Our time at Carmine’s was the perfect finish to our day. From cocktails, wine, appetizers, main dish and dessert…all were plated and displayed beautifully and delicious.  I’ve been here three times and the service is top notch. I highly recommend.  The valet parking is reasonable and very convenient."
597,SLG2015,5,5,5,5,44925,Carmines accommodated every request with good cheer. We enjoyed an excellent night with excellent service.
598,MACEats,4,5,5,4,44925,"Solid choice for Italian on the Eastside.  Perhaps the best.  White tablecloths gives this formal vibe but it wasn't pretentious.  I had the risotto which was cooked and seasoned perfectly.  I went for lunch with friends, and it was a bit loud for my taste but not ridiculous.  Service was excellent despite being a bit rushed as they were closing the kitchen for dinner service.  Overall, I would recommend."
599,ThomasKellerwannaBe,5,5,5,3,44925,"Carmine's is always a good choice.  Food, service, wine are all excellent.  Its a bit noisy and crowded with the Bellevue girls (real estate agents) that lunch or a birthday party of 15 ""Karens"" giggling at the top of their lungs. But they are entertaining."
600,OpenTable Diner,4,4,4,4,44923,For my friend’s birthday
601,RichardA,1,1,4,5,44918,"This is my favorite restaurant in the entire Seattle area. However today my food was late … someone forgot to cook it and then I got apps, salad and soup all at the same time. My Mac and Crab n Cheese was not close to the usual standards of this restaurant. I will come back as it is my favorite but I was very very disappointed this time."
602,TSTUD,4,5,4,4,44915,Pasta was excellent. Cauliflower soup was delicious. A little noisy and chilly but would absolutely return and recoo.
603,OpenTable Diner,4,5,4,5,44912,"Everything was wonderful except we waited a long time for appetizers, then starters came, and mention that entrees were next.  Asked about the appetizers which were apparently forgotten.  Apologies offered and we moved on, but it did detract from a perfect dining experience."
604,gmhd,5,5,5,5,44912,Lovely food in a very Italian setting.  Very popular at Christmas lunch time.  And the dessert menu is wonderful.
