,Name,Overall_Rating,Food_Rating,Service_Rating,Ambience_Rating,Dined_Date,Reviews
1411,LindaC,5,5,5,5,43874,"Always wonderful to eat at Carmine's Bellevue as well as Flagship Restaurant Il Terrazzo Carmine in Pioneer Square, Seattle.   Carmine's Bellevue is located just south of the Bellevue Park and looks out onto the Park with all the trees, and gentle slopes.  Service, menu choices and fine china make this the perfect spot.  This is no fast  casual place!  I will eat here again."
1412,AdrianR,5,5,5,5,43873,"Wonderful servers and excellent food!
The Adrian’s List of wines has great selections!"
1413,OpenTable Diner,5,5,5,5,43873,"Great food, service, and overall experience!"
1414,MaliniP,4,5,2,4,43873,"The food took to long to be served.  I was extremely underwhelmed by the service.  I expected better.  It took over an hour after we arrived for our order to be taken and food to arrive. For lunch, that is too long."
1415,OpenTable Diner,4,5,4,4,43872,Food took a little it was busy so understandable but the food was so very much worth the wait.  I recommend three herb crusted rack of lamb.
1416,BenE,3,3,3,2,43870,"First time visiting Carmine's and have heard nothing but good things. Overall the experience was good, not great. Unfortunately the restaurant was VERY loud. Of course we expected this going in on a busy Saturday night but as a group of 4 we found it very hard to hold conversation as we all had to keep leaning into the table to hear each other. It also made it challenging to order and interact with the servers. This can't really be controlled by the restaurant but perhaps there are additional ways they could look to improve the acoustics in the space? Not really sure. My only other issue was the steak I had was over-seasoned and came out extremely salty. I powered through it because I generally like salty foods but even this was over the top for me so I only ate about half of it. The rest of the food I had, and my friends had, was fantastic. Probably was just a one time miss I am guessing. I would recommend others to go to Carmine's and I will give it another shot for sure."
1417,IgorD,5,5,5,5,43869,Everything was perfect 👌🏽
1418,RobertR,5,5,5,5,43867,Absolutely fantastic experience
1419,Dawg,3,4,2,3,43867,"Placed a reservation for the 2 of us for our 20th anniversary lunch.  We were seated in the bar facing the tv.  Bar had a few tables and the server was the bartender.   There were several restaurant vendors in the bar working on menus and obviously getting the attention of the staff.  Food was good, service was okay, and lacked the ambiance of the Seattle location."
1420,OpenTable Diner,5,5,5,5,43866,Birthdays w friends. The food and drinks were delicious and the service was great. It was a wonderful evening. We all agreed that we will be returning.
1421,RandP,5,5,5,5,43866,"Great food, impeccable service...never disappoints!"
1422,RescueDogsRock,3,3,4,2,43865,"We were celebrating my husband’s birthday and had indicated this on our reservation. We were seated next to a family with two very small kids. One child would crawl across his Mom on the bench seat that my husband was seated on. The kid was trying to get our attention and was crawling very close to our table and to my husband. Like within a few inches as table spacing was tight. Really distracting, frustrating and frankly not what I expect or hope for in a higher end dining experience. Food was ok. My pork was really dry. They quickly offered to redo it so the server tried hard. Nonetheless I left feeling like I way overpaid given the very poor ambiance and the food quality. Disappointed."
1423,tapr,4,5,5,4,43863,"Highest quality food I have had in any restaurant.  I have traveled all of Europe, Caribbean  and most of the US.  Staff willing to ensure our visit was as expected."
1424,OpenTable Diner,5,5,5,5,43862,Had a great time celebrating birthdays and getting family together! Wonderful evening!!!
1425,CynthiaE,5,5,5,4,43862,Staff is fabulous! i would recommend for special occasion
1426,ChrisJ,4,4,5,5,43862,"It was very enjoyable. I have been here many times and I like it very much. I can’t go five stars because there are Italian places I enjoy more but you cannot go wrong. Excellent service, great quiet environment, and it is very comfortable. The cannelloni is very good."
1427,LindaC,5,5,5,5,43862,"This was the first time at Carmine's Bellevue.  I have dined in their flagship restaurant Il Terrazzo Carmine in Pioneer Square, Seattle many times.  Carmine's Bellevue is absolutely beautiful looking out onto the Bellevue City Park, a 21-acre oasis of green in the heart of Bellevue so the view is beautiful and restful.  The menu is typically Italian and well crafted.  They have valet parking to make it a treat to visit at any time."
1428,Rosie,3,2,4,4,43858,"The salad I ordered was almost all cheese and no dressing. Very blah. Not much take and chicken was dry. Cauliflower soup was very good, but very rich."
1429,AndrewS,4,5,5,3,43856,There was a large group of loud and seemingly drunk people behind us which took away from the date night we were trying to have. Otherwise it was an excellent experience with amazing food and wine.
1430,bmoreseattle,5,5,5,5,43854,"Food was amazing.  Highly recommend the bruschetta trio.  My friend and I both sound not stop raving about the bread; I do not know if it is made in house or not, but the bread was fresh and flavorful.  I thoroughly enjoyed my pesto and prawn fettuccini.  It struck the perfect balance--flavorful but not too salty, creamy but not heavy.  She enjoyed her cannelloni, which she said tasted authentic.  We were so stuffed that we did not make it to dessert.  However, we already decided halfway through our meal that we would have to go back with our family and friends.  We were celebrating her birthday.  The restaurant was fancier than expected, so I could see it being perfect for special occasions.  It is also spacious.  We went for lunch, so it was relatively quiet.  However, I imagine that it could get loud if the restaurant was full of diners.  Friendly and professional service.  Highly recommend the restaurant.  Cannot wait to go back."
1431,OpenTable Diner,5,5,5,5,43834,The best food and service! We had a great time
1432,Katella77,5,5,5,5,43833,Great service and food.  Love the decor.  You will not be disappointed.
1433,AdamW,5,5,5,5,43833,I enjoyed a wonderful dinner at Carmine's as usual. The waitstaff is professional and knowledgeable and will go the extra to ensure the customer experience is phenomenal.
1434,OpenTable Diner,5,5,5,5,43833,"Back again for a family dinner before kids headed out of town. Wonderful evening, as usual."
1435,kenp,3,3,4,4,43831,"Maybe because it was New Year's eve the food was pre-prepared? The food that came out was not piping hot and looked like it was sitting for awhile. In particular the Eggplant Parm which is usually excellent. The Linguine with Clams had lots of broken shells and grit. Quite disappointed in what is typically a very good dish.
It is a very nice place and will look at this last visit as an out liar."
1436,OpenTable Diner,5,5,5,5,43828,"We love it here ! 
We had 5pm reservation and we were running late bc we were still watching our play in Issaquah. Called to have it moved to 5:30. They were really accommodating. Good thing we made it before 5:30. 
And the most pleasant surprise was our waiter Brad from previous visit is serving us again! Yay! 
Our orders were delicious. Even gluten free pasta had texture and not mushy. My ossobuco was very flavorful and the bone marrow was fantastic! Alfredo small portion was a lot! Not complaining. 
Even the bread with crispy crust and chewy center leaves a lot of flavor in my palate. 
Brad was kind to chase us down the garage and return the credit card we left on the table. Saddest part was we left behind our leftovers😩
Overall it’s a great place to be in. It’s classy and not pretentious. Love the genuine people working in. 
Thanks again Brad for the great service
Will be back"
1437,FinanM,5,5,5,5,43827,"My husband and I truly love Carmine’s. They have the best customer service, food and ambience. Must try if you’re in the Seattle/Bellevue area. Cannot get enough of their pasta. ❤️"
1438,RachlS,4,5,3,4,43819,"We love Carmines and go often, however, the service this time was average at best. Our courses were spaced too far apart and we were sitting waiting for our mains for about 20minutes. My guess is they were over staffed. will update the review next time we go! We still love it!"
1439,sounder,4,5,5,3,43818,Much noisier than their Seattle restaurant.  Our location smelled fishy whenever they cooked Sea Bass.  Food and service were outstanding.  Next time I will return to their Seattle restaurant.
1440,JayM,5,5,5,4,43818,"Food and service were excellent.  The noise level was very high, mostly because they were very busy."
1441,SamanthaW,5,5,5,5,43818,"Love Carmines, simply the best in Bellevue and Seattle"
1442,TomB,3,3,5,3,43818,"We had reservations for two.  At first we were sat at a table in the middle of the floor right next to wait staff station who stood over us and were constantly whizzing by.  Not very good.  We asked to be reseated which they did right away.  That was great.  Our server, Katya, was excellent.  We felt the food was ok, but not spectacular.  Wines were overpriced.  All in all, it was ok, but not sure if we would return.  Maybe we'll give it another try after the holidays."
1443,MikeB,5,5,5,5,43817,Terrific food and great service
1444,OpenTable Diner,5,5,5,5,43817,"Wonderful food, service, and ambience as usual!"
1445,OpenTable Diner,5,5,5,5,43813,Had a great dinner. Our waiter was great and food was amazing! They also provided a complementary tiramisu for our Anniversary!
1446,NatalieS,5,5,5,5,43813,"Carmine’s remains the gold standard for fine Italian dining. Impeccable service, lovely ambiance, mouth-watering dishes. The veal never disappoints. The ravioli with wild mushrooms was a delight. Wonderful service with warmth. A perfect restaurant for any occasion."
1447,JanniT,5,5,5,5,43812,"Beautiful restaurant, consistently wonderful food, excellent service."
1448,ScotK,4,4,4,4,43812,"The food was excellent.  I ordered the veal scallopine and was prepared excellently.  

Our server was great. Efficient and not hovering constantly."
1449,ChelseaC,5,5,5,4,43811,"Phenomenal food and service. We were a little rushed for time and they worked with us to get food and bill in a timely fashion, otherwise I imagine we would have been welcomed to linger. Sweetly decorated for the holidays."
1450,dmw1,4,3,5,3,43809,"We’ve very much enjoyed Carmines on previous occasions, but this time were a bit disappointed with the food. The soup of the day (cream of asparagus) was bland and the texture uneven.  My wife’s cannelloni was disappointing as was my fettuccine with prawns.  On the positive side, the bread and spumoni were excellent and the service outstanding; all service people were unobtrusive but very attentive to our needs without being asked."
1451,BobK,5,5,5,5,43809,Best restaurant in Bellevue!
1452,Custis,5,4,5,5,43807,"We attending with two young girls, ages 5 & 8.  Maybe only ones with young kids.  The service was outstanding.  Our server was good with recommendations.  All of us enjoyed some type of pasta and all was good.  Lobster bisque and calamari were tasty.  This is our third time to enjoy Carmine's and will definitely return.  It was nice to get a complement from the hostess about the behavior of our young ladies.  Appreciative."
1453,TrishaC,5,5,5,5,43806,Love you sea bass !!!!!!❤️
1454,roberta,5,5,5,4,43806,Excellent dinner and excellent service.  Good people watching too.
1455,michul,5,5,5,5,43805,This has become a go to destination.  Amazing food and service was over the top!!
1456,MOGR,5,5,5,5,43804,"We had a great dinner with our special friends, the service was fantastic, the food was fabulous... pretty loud but we will be back without the extra holiday busy-ness!"
1457,Westcoastj,5,5,5,5,43804,"We always love Carmine’s. The food is delicious!!
 The ambiance is beautiful!!"
1458,lovetoeat,5,5,3,5,43802,"Paolo is snobby, dry and slow. His assistant Roberto is perfect. This is the second time I got below average service from Paolo and probably the last time. I will either request different server or go only to Il terrazzo"
1459,FrequentDiners,5,5,4,5,43800,"Waiter was excellent.  Supporting staff forgot things (water, more butter, things like that.  Overall a wonderful night out celebrating a birthday."
1460,NativeNewYorker,5,5,5,5,43800,"I hear the ‘Cheers’ theme song everytime I walk in.  The staff are always warm, friendly, professional. These people know how to run a successful restaurant.The food is always delicious and soul-satisfying. And the cocktails are always a proper pour."
1461,Wineo,5,5,5,5,43795,"Beautiful Decor and lovely staff that pays attention to all details for your dining experience.  Great Wine list to choose  Italian , California and Washington gems from."
1462,ErinH,5,5,5,5,43791,Love Carmines! My favorite place for a special lunch or dinner
1463,luv2eat,5,5,5,5,43790,We had a birthday lunch celebration and everything was perfect! I requested a round table which we got and we were so lucky that the restaurant wasn’t too busy so the noise level was perfectly fine. Our waiter was delightful and got everything that we requested. Great experience!
1464,GalaxyRisky,5,5,5,5,43789,"Just a little ""oops"".  I requested a quiet table...then, within 15 minutes a huge party of 20 were sat right next to us!  Not quiet!  So we moved tables. The hostess could have done better!"
1465,Lucy21,5,5,5,5,43789,Carmine’s never disappoints. The food is very good and nicely presented. The service is the best in Bellevue. And the reasonably priced valet service is a plus. I look forward to my next visit.
1466,KC75,5,5,5,5,43788,friend in town from LA. she loved the food and thought it was beautiful.
1467,OpenTable Diner,5,5,5,5,43788,Il Terrazzo Carmines Has been my favorite restaurant since I was a child and my parents loved it to go for special occasions. Carmine’s is every bit as good and a favorite spot for my husband and I to celebrate anything and everything from a mundane day to a birthday to an anniversary…
1468,OpenTable Diner,5,5,5,5,43788,Superior food and service
1469,OpenTable Diner,2,3,2,3,43786,Parking directions were unclear. Tables too close together. Food was not that great.
1470,Jaskk,5,5,5,5,43784,Delicious food.
1471,brunchbunch,2,2,2,1,43784,"Service was not impressive, they know how many guests they will have and the wait staff were rushing around in a stupid frenzy. Not the best atmosphere for a special dinner out. It felt like a very busy night which they should have been prepared for."
1472,DebP,5,5,5,5,43783,Very nice evening with in a quiet corner
1473,ChrisC,5,5,5,4,43783,"Birthday great service, good food. I have been going to Carmines in Seattle for years and like the Bellevue location equally well."
1474,JoeS,5,5,5,5,43783,Brian was great and the food was scrumptious.  We will be back!
1475,AnnS,5,5,5,4,43779,"As always, the service was excellent and the food scrumptious  I will be back soon."
1476,OpenTable Diner,5,5,5,5,43777,Lunch during the week was nice and quiet
1477,AprilE,5,5,5,5,43775,Came here for a friends birthday day and was very happy with the service. When we arrived they'd gone out of their way to leave a note for her on the table that said Happy Birthday and everything. Waitress was extremely helpful in selecting out drinks and food. Only real note was that it did take a while for the food to arrive to the table but we were given bread to hold off and enjoyed the atmosphere so it wasn't really a bother.
1478,OpenTable Diner,5,5,5,5,43772,Wedding celebration
1479,DaniT,5,5,5,5,43771,"The food was INCREDIBLE and the service was phenomenal!! They made my birthday and anniversary fantastic and so special!! Definitely a fun place for special celebrations, I saw some people there causally as well"
1480,MaxK,5,5,5,5,43771,"Every experience at Carmine’s is special and delightful. It’s been my favorite restaurant in Bellevue for a while now and for good reason. The ambiance is posh, food is delicious, and the service is really special. This time around I tried a few different items on the menu. For appetizers I strongly suggest the eggplant parmesan! The beef tartare was also quite delicious! For main courses the osso buco, duck breast, halibut, fileto con gnocchi, and ribeye are my personal favorites! I asked for my ribeye to be medium-rare and it came out perfectly! It melted in my mouth. If you are a fan of osso buco this is the best osso buco I’ve ever had. The halibut is soft and flaky! For dessert they have the best spumoni ice cream, tiramisu, semifreddo, and profiteroles. I tried the profiteroles for the first time yesterday and I was blown away. They have this rich melted chocolate on top of them and they looked gorgeous. For Washington wine I suggest the quilceda creek, Cayuse, or D2. For Italian wine I really liked the Vigorello. I’m terms of white French white wine I was really impressed with the christophe pichon condrieu. They also have a Vueve Rose which is delicious! The manager Adrian really works hard to make sure we felt special during our reservation. Everything was perfect per usual and I can’t wait to come back!"
1481,ToddJ,5,5,5,5,43767,"Great food,exceptional service.
Our new “go to” spot in Bellevue 
Fantastic overall experience"
1482,SteveL,5,5,5,5,43765,Very nice all around.
1483,ThomasKellerwannaBe,5,5,5,5,43764,"Very romantic old world Italian restaurant where everything is impeccable. food, wine selection, service could not be better."
1484,OpenTable Diner,5,5,4,5,43762,Honestly it was delicious I used to work valet here and finally got to have dinner here I would absolutely recommend this place! Me and my girlfriend had a wonderful time!
1485,Aubern,5,5,5,5,43758,"Superb! Everything was spectacular, from food, service, ambiance. The restaurant was recommended by a friend and we are so glad we took her up on the recommendation."
1486,OpenTable Diner,5,5,5,5,43758,"It was GREAT! Made reservation from open table. Requested a quiet table for birthday dinner. We arrived at table was a birthday card welcoming us. Wait staff showed at our table right away. Our ordering experience was swift and dinners served in a timely manner and all foods were popping hot. 
We both enjoyed the halibut and veal scallopini. We ordered extra gluten free pasta and squid ink pasta. It was all delicious and flavorful. Oh! The bread was awesome ! Crispy crust and chewy flavorful texture. Best bread EVER! 
Brett was a very great waiter that served us. He was pleasant, patient and humerous. Our overall experience at Carmine’s was WAYYYYYYY better than Ascend Prime steak. It felt genuine at Carmine’s. Interior is classy as well as the patio going into the restaurant. It’s well kept and clean. We will return"
1487,pickyeater,4,4,4,3,43757,"LOVE Carmine’s. This night, the restaurant was packed and we were seated next to a very large"
1488,KimP,5,5,5,4,43756,Amazing food and excellent service. Just a little difficult to hear each other talk across the table.
1489,OpenTable Diner,5,5,5,5,43756,"I had an amazing luncheon with the best friend, the food was amazing, the atmosphere was lovely & the staff were so friendly and helpful. Can’t wait to go back !!!!"
1490,Alina,5,5,5,5,43755,Such a lovely experience and felt so valued and cared for. Food was amazing and staff was excellent!
1491,DarrenT,5,5,5,5,43755,"Great food, decent portions, attentive wait staff."
1492,Shoemake,5,5,5,5,43753,Great place for our 10 year Anniversary dinner!
1493,stevenm,5,5,5,5,43751,"Fantastic experience. Food wonderful, atmosphere fantastic but best of all the staff were amazing. From the kitchen staff to our server. They made a memorable night more memorable. Great job. Highly recommend."
1494,OpenTable Diner,5,5,5,5,43750,Absolutely wonderful!
1495,sister,5,5,5,5,43748,"I am a regular here, but this was my sister's first time in. She really enjoyed the atmosphere, and said that  the restaurant is beautiful. Food was great as always and our server was energetic, friendly, and knowledgeable."
1496,datenightdiner,3,3,2,2,43748,This is a big noisy restaurant. I just got back from Italy and the food at Carmine’s does not compare
1497,aierfalomn,5,5,5,5,43748,"First time visit, very competent staff & chef, lots of gluten-free options. No bad dishes, always a good sign. Halibut special was amazing. Even the panna-cotta was excellent. Relaxed ambience. Will be back!"
1498,PattiF,5,5,5,5,43748,"Celebrating a big birthday was treated as a very special occasion, and we loved it!  The complimentary dessert was amazing!"
1499,Kathy,5,5,5,4,43747,"I took a friend to Carmine's for her birthday and there was a little birthday note on the table when we arrived, and they brought out a chocolate mousse with a chocolate ""Happy Birthday"" drizzle on the plate - so very thoughtful and appreciated!  We both ordered a side caesar salad and never wanted it to end - so good!!  She had the halibut special and I had gnocchi with brown butter - she loved her halibut and my gnocchi was fluffy and so delicious.  Oh, and I wanted to eat the entire basket of bread...just enough crust on the outside and softness on the inside.  Carmine's isn't cheap but not prohibitively expensive either - just a wonderful place for a celebration or any time you want a delicious meal in a beautiful atmosphere."
1500,CB333,5,5,5,5,43744,Wonderful food and service. I have been here several times and never disappoints.
1501,dmw1,4,5,5,2,43744,"Superior food, attentive and cordial service on a busy Saturday night.  Room is very, very noisy and, as I am hard of hearing, I was fortunate to have my wife with me to maintain a conversation with our guest."
1502,CatherineB,3,3,4,4,43744,"Although I enjoyed the service and ambiance very much, the food was somewhat disappointing for such an upscale Italian restaurant. House bread was flavourful and fresh. The Burrata was excellent. The Insalata di Mista was ridiculously overpriced and not remarkable in the least. Lettuce with vinegar for $18? Should have been $9.  I also wasn't overly impressed with my gnocchi. It was bland and a very mushy. One of my friends had the veal and said it was also not at all at the level that she expected. My third friend LOVED her Rigatoni Bolognese.  That's why the mostly 3 stars. I love Italian food and have been to Italy 4 times, so maybe my bar is too high.

I would like to give it another try, especially as it's a great looking place with awesome waiters, but unless I am back in Bellevue for some reason I would probably look elsewhere."
1503,Naylam,5,5,5,5,43744,"love the amazing experience and great food! 
our favorite place for a night out or special celebration."
1504,OpenTable Diner,3,3,5,4,43741,"Way too noisy.
Food OK.
Would not go there again, stick to the Seattle one.
."
1505,DENNISG,5,5,5,5,43741,The service was very customer oriented and waiter met our every need..  The food was very good.  Will go back.
1506,glena,5,5,5,5,43740,"Wait staff was attentive and courteous.  Food was spectacular, and the ambience was as expected in an upscale establishment.  Would definitely recommend to others."
1507,MaryG,5,5,5,5,43739,Consistently great food and service.  Our go to for special occasions.
1508,ChrisG,5,5,5,5,43739,"Our server was exceptional. He was friendly, knowledgeable and charming."
1509,KMez,5,5,5,5,43737,We had dinner here to celebrate my birthday and I wanted to go someplace new. We really enjoyed the dinner. The food and service is amazing so was the wine!  Carmine’s made the night special!
1510,MaxB,5,5,5,5,43735,"Lively atmosphere, Tuscan decor, knowledgeable service, good food, delicious Tiramisu"
1511,stu2you,5,5,5,5,43735,We went to Carmine's for my birthday. The staff greeted us warmly as we walked in. Our waiter was unusually friendly and told us about the evening's specials. My wife and I ordered the cream of asparagus soup and the petrale sole both of which were excellent. The waiter brought my dessert with a candle in it. The service was outstanding and the noise level was fairly low for the size of the restaurant. Everybody had a wonderful time.
1512,SheilaG,5,5,5,5,43734,"Always a perfect meal. Excellent service, lovely setting, delicious ingredients and preparation. So happy you are in bellevue!"
1513,mothernatalie,5,5,5,5,43732,It was plain and simply fabulous . The food was outstanding and we enjoyed it thoroughly
1514,BayAreaTransplant,5,5,5,5,43732,"Great food, great service and great atmosphere.  We enjoyed a nice meal with friends and each of us enjoyed our dishes."
1515,traveler,4,5,5,5,43732,Love everything about this place except the noise level. It is just way too loud no matter what part of the restaurant or bar I have sat in
1516,kathrynR,5,5,5,5,43730,Always love Carmines.  Service is great and the food choices are wonderful.  Thank you as always
